{
  "schemaVersion": 1,
  "overlayId": "accent_verna_2005_knowledge",
  "overlayVersion": "1.0.0",
  "sourceCorpusHash": "7a4a2f2f328bf422ea1c4d987f88eb093e664d6cf4e53609282506d4261d960f",
  "sourceInputs": {
    "corpusManifestPath": "public/knowledge/proprietary/manifest.json",
    "corpusId": "meet_owner_proprietary_parts_corpus",
    "corpusVersion": "1.0.0",
    "curatedPacks": [
      {
        "packId": "pack_06_dtc_P0230",
        "packVersion": "1.0.0",
        "path": "android/app/src/main/assets/knowledge/packs/pack_06_dtc_P0230.json",
        "authority": "GENERIC_CONCEPTUAL",
        "reviewState": "REVIEW_REQUIRED"
      },
      {
        "packId": "pack_07_hyundai_accent_verna_2005_profile",
        "packVersion": "1.0.0",
        "path": "android/app/src/main/assets/knowledge/packs/pack_07_hyundai_accent_verna_2005_profile.json",
        "authority": "ENGINEERING_INFERENCE",
        "reviewState": "REVIEW_REQUIRED"
      }
    ]
  },
  "referenceVehicleProfile": {
    "id": "hyundai_accent_verna_2005_1_6_at",
    "nodeId": "hyundai_accent_verna_2005_1_6_at",
    "make": "Hyundai",
    "models": ["Accent", "Verna"],
    "year": 2005,
    "engine": "1.6L; engine code and market require VIN or OEM confirmation",
    "transmission": "Automatic; exact variant requires VIN or OEM confirmation",
    "marketState": "UNCONFIRMED",
    "requiresVinConfirmation": true,
    "applicability": "CONDITIONAL",
    "confidence": "MEDIUM",
    "reviewState": "REVIEW_REQUIRED",
    "sourceBlockIds": ["block_000040_82d1f224cb", "block_000042_263b88892e"],
    "sourceRefs": [
      {
        "sourceDocumentId": "document_17",
        "blockId": "block_000040_82d1f224cb",
        "textHash": "82d1f224cb82d5436589d51335d0ee279f1ec5e2e684c3fa5ecd8f6432409509"
      },
      {
        "sourceDocumentId": "document_17",
        "blockId": "block_000042_263b88892e",
        "textHash": "263b88892e5e814bf30b83adc04e43fb6dce7d465c066ec0946a09b7bf294c9c"
      }
    ],
    "curatedSourceIds": ["pack_07_hyundai_accent_verna_2005_profile"],
    "evidenceRequired": ["vin", "market", "engine_code", "physical_inventory"]
  },
  "nodes": [
    {
      "id": "hyundai_accent_verna_2005_1_6_at",
      "type": "VEHICLE_PROFILE",
      "label": "Hyundai Accent/Verna 2005 1.6 AT",
      "canonicalKey": "hyundai_accent_verna_2005_1_6_at",
      "description": "Reference profile with market, engine code and exact equipment intentionally left evidence-gated.",
      "sourceBlockIds": ["block_000040_82d1f224cb", "block_000042_263b88892e"],
      "sourceRefs": [
        {
          "sourceDocumentId": "document_17",
          "blockId": "block_000040_82d1f224cb",
          "textHash": "82d1f224cb82d5436589d51335d0ee279f1ec5e2e684c3fa5ecd8f6432409509"
        },
        {
          "sourceDocumentId": "document_17",
          "blockId": "block_000042_263b88892e",
          "textHash": "263b88892e5e814bf30b83adc04e43fb6dce7d465c066ec0946a09b7bf294c9c"
        }
      ],
      "curatedSourceIds": ["pack_07_hyundai_accent_verna_2005_profile"]
    },
    {
      "id": "map_sensor",
      "type": "COMPONENT",
      "label": "Sensor MAP",
      "canonicalKey": "map_sensor",
      "sourceBlockIds": ["block_000042_263b88892e"],
      "sourceRefs": [{"sourceDocumentId": "document_17", "blockId": "block_000042_263b88892e", "textHash": "263b88892e5e814bf30b83adc04e43fb6dce7d465c066ec0946a09b7bf294c9c"}],
      "curatedSourceIds": ["pack_07_hyundai_accent_verna_2005_profile"]
    },
    {
      "id": "iat_sensor",
      "type": "COMPONENT",
      "label": "Sensor IAT",
      "canonicalKey": "iat_sensor",
      "sourceBlockIds": ["block_000042_263b88892e"],
      "sourceRefs": [{"sourceDocumentId": "document_17", "blockId": "block_000042_263b88892e", "textHash": "263b88892e5e814bf30b83adc04e43fb6dce7d465c066ec0946a09b7bf294c9c"}],
      "curatedSourceIds": ["pack_07_hyundai_accent_verna_2005_profile"]
    },
    {
      "id": "mechanical_throttle",
      "type": "ASSEMBLY",
      "label": "Acelerador mecánico por cable",
      "canonicalKey": "mechanical_throttle",
      "sourceBlockIds": ["block_007342_1d1f4864bc"],
      "sourceRefs": [{"sourceDocumentId": "document_17", "blockId": "block_007342_1d1f4864bc", "textHash": "1d1f4864bcaba0a115619af84223b82aae572578a0c16b1d8b5a61de7de5c359"}],
      "curatedSourceIds": ["pack_07_hyundai_accent_verna_2005_profile"]
    },
    {
      "id": "fuel_pump",
      "type": "COMPONENT",
      "label": "Bomba eléctrica de combustible",
      "canonicalKey": "fuel_pump",
      "sourceBlockIds": ["block_007066_be030d00fb", "block_007622_4790cad377"],
      "sourceRefs": [
        {"sourceDocumentId": "document_17", "blockId": "block_007066_be030d00fb", "textHash": "be030d00fbc04f6912bd625a1063543b7b08c6c22249e27817198d436b858023"},
        {"sourceDocumentId": "document_17", "blockId": "block_007622_4790cad377", "textHash": "4790cad377fcb13b4d33d345ade879ce855db127401471d2ddd4c96763e1116b"}
      ],
      "curatedSourceIds": ["pack_06_dtc_P0230", "pack_07_hyundai_accent_verna_2005_profile"]
    },
    {
      "id": "pcm_driver",
      "type": "COMPONENT",
      "label": "Controlador PCM del relé de bomba",
      "canonicalKey": "pcm_driver",
      "sourceBlockIds": [],
      "sourceRefs": [],
      "curatedSourceIds": ["pack_06_dtc_P0230"]
    },
    {
      "id": "maf_sensor",
      "type": "COMPONENT",
      "label": "Sensor MAF",
      "canonicalKey": "maf_sensor",
      "sourceBlockIds": ["block_000042_263b88892e"],
      "sourceRefs": [{"sourceDocumentId": "document_17", "blockId": "block_000042_263b88892e", "textHash": "263b88892e5e814bf30b83adc04e43fb6dce7d465c066ec0946a09b7bf294c9c"}],
      "curatedSourceIds": ["pack_07_hyundai_accent_verna_2005_profile"]
    },
    {
      "id": "app_sensor",
      "type": "COMPONENT",
      "label": "Sensor APP electrónico",
      "canonicalKey": "app_sensor",
      "sourceBlockIds": ["block_000042_263b88892e", "block_007342_1d1f4864bc"],
      "sourceRefs": [
        {"sourceDocumentId": "document_17", "blockId": "block_000042_263b88892e", "textHash": "263b88892e5e814bf30b83adc04e43fb6dce7d465c066ec0946a09b7bf294c9c"},
        {"sourceDocumentId": "document_17", "blockId": "block_007342_1d1f4864bc", "textHash": "1d1f4864bcaba0a115619af84223b82aae572578a0c16b1d8b5a61de7de5c359"}
      ],
      "curatedSourceIds": ["pack_07_hyundai_accent_verna_2005_profile"]
    },
    {
      "id": "eps",
      "type": "ASSEMBLY",
      "label": "Dirección asistida eléctrica EPS",
      "canonicalKey": "eps",
      "sourceBlockIds": ["block_003302_cccaa028f7", "block_007066_be030d00fb"],
      "sourceRefs": [
        {"sourceDocumentId": "document_17", "blockId": "block_003302_cccaa028f7", "textHash": "cccaa028f758b8f7120d7bd118478b6b76ac9080edb27d01fa63122ae0ae7dfd"},
        {"sourceDocumentId": "document_17", "blockId": "block_007066_be030d00fb", "textHash": "be030d00fbc04f6912bd625a1063543b7b08c6c22249e27817198d436b858023"}
      ],
      "curatedSourceIds": ["pack_07_hyundai_accent_verna_2005_profile"]
    },
    {
      "id": "epb",
      "type": "ASSEMBLY",
      "label": "Freno de estacionamiento eléctrico EPB",
      "canonicalKey": "epb",
      "sourceBlockIds": ["block_007066_be030d00fb", "block_026778_5c389450bc"],
      "sourceRefs": [
        {"sourceDocumentId": "document_17", "blockId": "block_007066_be030d00fb", "textHash": "be030d00fbc04f6912bd625a1063543b7b08c6c22249e27817198d436b858023"},
        {"sourceDocumentId": "document_17", "blockId": "block_026778_5c389450bc", "textHash": "5c389450bca61a7646b5b4523dd1ace122ad31fb9dc3e5bfce95fa1543c86dd5"}
      ],
      "curatedSourceIds": ["pack_07_hyundai_accent_verna_2005_profile"]
    },
    {
      "id": "turbocharger",
      "type": "ASSEMBLY",
      "label": "Turbocompresor",
      "canonicalKey": "turbocharger",
      "sourceBlockIds": ["block_000040_82d1f224cb", "block_000042_263b88892e"],
      "sourceRefs": [
        {"sourceDocumentId": "document_17", "blockId": "block_000040_82d1f224cb", "textHash": "82d1f224cb82d5436589d51335d0ee279f1ec5e2e684c3fa5ecd8f6432409509"},
        {"sourceDocumentId": "document_17", "blockId": "block_000042_263b88892e", "textHash": "263b88892e5e814bf30b83adc04e43fb6dce7d465c066ec0946a09b7bf294c9c"}
      ],
      "curatedSourceIds": ["pack_07_hyundai_accent_verna_2005_profile"]
    },
    {
      "id": "diesel_system",
      "type": "SYSTEM",
      "label": "Sistema diésel common rail",
      "canonicalKey": "diesel_system",
      "sourceBlockIds": ["block_000040_82d1f224cb", "block_000042_263b88892e"],
      "sourceRefs": [
        {"sourceDocumentId": "document_17", "blockId": "block_000040_82d1f224cb", "textHash": "82d1f224cb82d5436589d51335d0ee279f1ec5e2e684c3fa5ecd8f6432409509"},
        {"sourceDocumentId": "document_17", "blockId": "block_000042_263b88892e", "textHash": "263b88892e5e814bf30b83adc04e43fb6dce7d465c066ec0946a09b7bf294c9c"}
      ],
      "curatedSourceIds": ["pack_07_hyundai_accent_verna_2005_profile"]
    },
    {
      "id": "dpf",
      "type": "ASSEMBLY",
      "label": "Filtro de partículas diésel DPF",
      "canonicalKey": "dpf",
      "sourceBlockIds": ["block_000040_82d1f224cb", "block_000042_263b88892e"],
      "sourceRefs": [
        {"sourceDocumentId": "document_17", "blockId": "block_000040_82d1f224cb", "textHash": "82d1f224cb82d5436589d51335d0ee279f1ec5e2e684c3fa5ecd8f6432409509"},
        {"sourceDocumentId": "document_17", "blockId": "block_000042_263b88892e", "textHash": "263b88892e5e814bf30b83adc04e43fb6dce7d465c066ec0946a09b7bf294c9c"}
      ],
      "curatedSourceIds": ["pack_07_hyundai_accent_verna_2005_profile"]
    },
    {
      "id": "adas",
      "type": "SYSTEM",
      "label": "ADAS de fábrica",
      "canonicalKey": "adas",
      "sourceBlockIds": ["block_016970_f17650c335"],